id,type,text1,text2,text3,text4,notes
volantian_cressida,SHIP,"The Cressida is a smaller-sized vessel that utilizes the same principles as the Doom-Class Cruiser to lay mines, while doing so safely with the use of it's phase cloak. It has decent armor for a phase ship, allowing it to spend more time in harm's way delivering heavy ordinance. Many of the psychological issues regarding phase ships are somewhat reduced, given the Cressida's finely-tuned phase coils and somewhat generous crew amenities.",,,,
,,,,,,
volantian_temporaltransit,SHIP_SYSTEM,"Temporarily increases timeflow on the ship, disable all weapon when system is active.",,,,
volantian_guardianarccore,SHIP_SYSTEM,"Provides a boost to top speed, along with a slight maneuverability boost, discharges EMP arcs that deal damage to nearby fighters, missiles and ships.",,,,
volantian_transfixshift,SHIP_SYSTEM,"Provides a boost to top speed, along with maneuverability boost, reducing armor damage taken by 80% during activation. Activate when phased remove upkeep flux upkeep cost for the duration of activation.",,,,
volantian_shellswarp,SHIP_SYSTEM,Teleports a heavy shell to the target area. The mine will slowly track nearby enemy ships and explodes a few seconds after its proximity trigger is activated. Can be used while phased. Stores three charges,,,,
volantian_rapturepulse,SHIP_SYSTEM,"After a brief chargeup, unleashes a massive EMP pulse that overloads every enemy ship in range.",,,,
,,,,,,
vol_clovercannon,WEAPON,"Contrary to popular belief, instead of projecting bolts of plasma or energy, the Clover Cannon actually accelerates temporally-excited magnesium shells toward it's target, and a cloud of tightly-compressed ions form a shield around it for the classic scarlet color of the 'bolt.' Clover projectiles are known to excite particles in the immediate area of impact (including shields), causing localized explosions when subject to repeated impacts.",,,,
vol_cryocannon,WEAPON,"Utilizing barely-understood properties of thermodynamics and a vast internal capacitor, the CPC casts bolts of pure thermal energy at terrifying rates- many less-experienced officers tend to squander it's potential for burst damage.",,,,
vol_halon,WEAPON,"Two Halon units on a single mount was originally a joke amongst senior WSO's- however, the sheer effectiveness in testing saw it almost immediately made standard among Volantian fleets.",,,,
vol_halonMK1,WEAPON,"A refinement of the Burst PD laser, the Halon was developed as a rather simple and straightforward point-defense platform that now sees widespread use in stead of the underwhelming Pata-class autocannon.",,,,
vol_harpecannon,WEAPON,"The Harpe Cannon provides long-range pressure in the form of a very sophisticated caseless ammunition feeder, featuring tungesten-jacketed rail spikes that can pressure shield generators with ease.",,,,
vol_kastane,WEAPON,"The Kastane system has been called by many as a slow, inefficient weapon. Nonetheless, it is dependable and can reliably hit slow-moving targets.",,,,
vol_katti,WEAPON,"The Katti-Class torpedo is a dual-stage missile that first orients itself, then accelerates to frightening speeds to deliver it's volatile payload into it's target. This particular mount holds two.",,,,
vol_katti_single,WEAPON,,,,,
vol_kattibarrage,WEAPON,"The Katti-Class torpedo is a dual-stage missile that first orients itself, then accelerates to frightening speeds to deliver it's volatile payload into it's target. This particular delivery system can down heavily-armored capital ships with ease..",,,,
vol_kudi,WEAPON,,,,,
vol_laevaten,WEAPON,"The ""Ten"" as it's usually referred to by most spacers, is capable of producing a torrent of ionizing energy that's capable of bypassing shield generators.",,,,
vol_lucern,WEAPON,"The seemingly inadequate payload carried by Lucern platforms is often seen as unsuitable for extended engagements- however, the payload that each individual missile carries compensates immesurably.",,,,
vol_lucern_HE,WEAPON,,,,,
vol_lucern_KE,WEAPON,,,,,
vol_monoblade,WEAPON,"First seeing use by some long-dead polite on the far reaches of the Persean Sector, this powerful railgun is given a new life as the opening volleys of Volantian fleets.",,,,
,,,,,,
,,,,,,
vol_opalescent ,WEAPON,,,,,
vol_pataautocannon,WEAPON,"Volantian fleets somewhat lack in close range weaponry- however, the Pata is capable of providing hefty fire- to any captain willing to get close enough to use it.",,,,
vol_tekkocannon,WEAPON,"The Tekko-class cannon is a somewhat lackluster point-defense weapon- after being outclassed by the newer Halon platform, it now only sees usage when the former isn't availible",,,,
vol_phosphenelance,WEAPON,"Able to project a phosphor-energy lance across a great distance, this high-powered lens focuser is able to cause localized explosions on the point of impact and cause severe damage to any unshielded target.",,,,
vol_trident,WEAPON,"This somewhat flux-hungry railgun was originally meant to be a grappling tether, being able to hook smaller frigates and reel them in- however, due to unfortunate circumstances regarding project funding and creative differences, it was instead redesigned to be a very effective railgun.",,,,
vol_surik,WEAPON,"The Surik Multiple Independent Release Vehicle (MIRV) is a sophisticated ordinance delivery system- splitting into 5 Katti-Class torpedoes, which can overwhelm most point-defense nets.",,,,
,,,,,,
volantian_spark,SHIP,"An autonomous AI fighter, this upgraded Spark is a tough and an agile interceptor. With no need to protect a human pilot, the chassis instead cradles a miniaturized shield generator, and two Tekko-class autocannons.",,,,
volantian_lux,SHIP,"An autonomous AI heavy fighter, this upgraded Lux is armed with a Pata Autocannon, an ion cannon, and a flare system designed to confuse opposing point defense systems. Best used to open a path for strikes against heavy targets or to simply spearhead an offensive push.",,,,
volantian_flash,SHIP,"An autonomous AI fighter-bomber, this upgraded Flash carries a hefty payload of a Katti-class torpedo. The missile often travels fast enough to bypass most point-defense systems.",,,,
volantian_longcaster,SHIP,"The longcaster class fighter is a unique chassis that houses a single needler and a prototype targeting core that directly interfaces with the pilot’s nervous system and sensory organs. Psychological effects are minimal, but pilots often report cravings for old earth cuisines.",,,,
